{
  "$schema": "http://json-schema.org/draft-07/schema#",
  "title": "KeyboardBuilders index",
  "type": "array",
  "items": {
    "type": "object",
    "additionalProperties": false,
    "required": [
      "name",
      "repo",
      "image",
      "form_factors",
      "firmware_targets",
      "mcu"
    ],
    "properties": {
      "name": {
        "type": "string",
        "minLength": 1
      },
      "repo": {
        "type": "string",
        "format": "uri"
      },
      "image": {
        "type": "string",
        "format": "uri"
      },
      "form_factors": {
        "type": "array",
        "items": {
          "enum": [
            "split",
            "unibody",
            "splay",
            "concave",
            "tilt"
          ]
        },
        "uniqueItems": true,
        "minItems": 0
      },
      "keys": {
        "type": [
          "integer",
          "null"
        ],
        "minimum": 10,
        "maximum": 120
      },
      "mcu": {
        "enum": [
          "ATmega32U4",
          "Adafruit Feather nRF52 Bluefruit",
          "Blackpill",
          "Pico",
          "Pro Micro",
          "RP2040 Zero",
          "RP2040",
          "Teensy 2.0",
          "nice!nano",
          "Xiao BLE"
        ]
      },
      "firmware_targets": {
        "type": "array",
        "items": {
          "enum": [
            "Absolem",
            "Atreus",
            "BlueMicro",
            "VIA",
            "Vial",
            "QMK",
            "ZMK",
            "KMK"
          ]
        },
        "minItems": 1,
        "uniqueItems": true
      },
      "last_updated": {
        "type": "string",
        "format": "date"
      }
    }
  }
}
